{
  "$schema": "https://json-schema.org/draft/2020-12/schema",
  "$id": "intelli-v1/reservation@1",
  "type": "object",
  "required": [
    "schema",
    "schemaVersion",
    "namespaceId",
    "sequence",
    "runId",
    "operationId",
    "compatibilityKey",
    "startedUtc",
    "allocationHash"
  ],
  "properties": {
    "schema": {
      "type": "string",
      "const": "intelli-v1/reservation"
    },
    "schemaVersion": {
      "type": "number",
      "const": 1
    },
    "namespaceId": {
      "type": "string",
      "pattern": "^[0-9a-f]{32}$"
    },
    "sequence": {
      "type": "integer",
      "minimum": 1,
      "maximum": 9007199254740991
    },
    "runId": {
      "type": "string",
      "pattern": "^[a-z0-9][a-z0-9-]{0,127}$"
    },
    "operationId": {
      "type": "string",
      "minLength": 1,
      "maxLength": 256
    },
    "compatibilityKey": {
      "type": "string",
      "pattern": "^sha256:[0-9a-f]{64}$"
    },
    "startedUtc": {
      "type": "string",
      "pattern": "^\\d{4}-\\d{2}-\\d{2}T\\d{2}:\\d{2}:\\d{2}(\\.\\d{1,9})?Z$"
    },
    "allocationHash": {
      "type": "string",
      "pattern": "^[0-9a-f]{64}$"
    }
  },
  "additionalProperties": false
}
