{"allocationHash":"98b77a60395041c96fdda219e0b0e8609d127acd42668c8f7e8d502d8835a2ad","compatibilityKey":"sha256:8d1dd12b458da77b329e68d6e96645ed2e0618ef7645900d72b85a54c662ff15","namespaceId":"0123456789abcdef0123456789abcdef","operationId":"op-2","runId":"2026-10-18-example-run-store-query-22222222222222222222222222222222","schema":"intelli-v1/reservation","schemaVersion":1,"sequence":2,"startedUtc":"2026-10-18T12:00:00.000Z"}
